{
  "$schema": "https://json-schema.org/draft/2020-12/schema",
  "$id": "https://sustainablecatalyst.com/schemas/scfs-github-connection-settings-v1.schema.json",
  "title": "Sustainable Catalyst GitHub Connection Settings",
  "type": "object",
  "required": [
    "schema",
    "version",
    "authentication_source",
    "authentication_configured",
    "github_app_configured",
    "webhook_secret_source",
    "webhook_secret_configured"
  ],
  "properties": {
    "schema": {
      "const": "scfs-github-connection-settings/1.1"
    },
    "version": {
      "const": "7.8.1"
    },
    "authentication_source": {
      "enum": [
        "none",
        "wp_config",
        "environment",
        "wordpress",
        "github_app_wp_config",
        "github_app_environment",
        "github_app_wordpress"
      ]
    },
    "authentication_configured": {
      "type": "boolean"
    },
    "github_app_configured": {
      "type": "boolean"
    },
    "github_app_id_source": {
      "enum": [
        "none",
        "wp_config",
        "environment",
        "wordpress"
      ]
    },
    "github_app_installation_id_source": {
      "enum": [
        "none",
        "wp_config",
        "environment",
        "wordpress"
      ]
    },
    "github_app_private_key_source": {
      "enum": [
        "none",
        "wp_config",
        "environment",
        "wordpress"
      ]
    },
    "installation_token_cached": {
      "type": "boolean"
    },
    "installation_token_expires_at": {
      "type": "string"
    },
    "token_source": {
      "enum": [
        "none",
        "wp_config",
        "environment",
        "wordpress"
      ]
    },
    "token_configured": {
      "type": "boolean"
    },
    "webhook_secret_source": {
      "enum": [
        "none",
        "wp_config",
        "environment",
        "wordpress"
      ]
    },
    "webhook_secret_configured": {
      "type": "boolean"
    },
    "mapped_repository_count": {
      "type": "integer",
      "minimum": 0
    },
    "last_tested_at": {
      "type": "string"
    }
  },
  "additionalProperties": false
}
